{
  "schema_version": "skillrun.public_site.v1",
  "generated_from": {
    "repo": "https://github.com/iiwish/skillrun",
    "source_commit": "7bab5cb",
    "updated_at": "2026-05-27"
  },
  "product": {
    "name": "SkillRun",
    "repo_url": "https://github.com/iiwish/skillrun",
    "positioning": "SkillRun is the runtime / contract / evidence layer for executable Agent Skills. Agent Skills are the authoring and discovery layer; MCP is an invocation surface."
  },
  "release": {
    "current_development_line": "v0.6.5",
    "latest_public_release": "v0.6.5",
    "version_command_output": "skillrun 0.6.5",
    "release_url": "https://github.com/iiwish/skillrun/releases/tag/v0.6.5",
    "latest_download_base_url": "https://github.com/iiwish/skillrun/releases/latest/download",
    "installers": {
      "shell": {
        "label": "macOS / Linux",
        "command": "curl --proto '=https' --tlsv1.2 -LsSf https://github.com/iiwish/skillrun/releases/latest/download/skillrun-installer.sh | sh\nskillrun --version"
      },
      "powershell": {
        "label": "Windows PowerShell",
        "command": "powershell -ExecutionPolicy Bypass -c \"irm https://github.com/iiwish/skillrun/releases/latest/download/skillrun-installer.ps1 | iex\"\nskillrun --version"
      }
    },
    "assets": [
      {
        "name": "sha256.sum",
        "kind": "checksum",
        "platform": "all",
        "url": "https://github.com/iiwish/skillrun/releases/download/v0.6.5/sha256.sum",
        "digest": "sha256:d8d24c26c9764278e6b190d94247f119acfb36e9b36c06a3082a1dd00fc16b4b"
      },
      {
        "name": "skillrun-installer.sh",
        "kind": "installer",
        "platform": "macOS / Linux",
        "url": "https://github.com/iiwish/skillrun/releases/download/v0.6.5/skillrun-installer.sh",
        "digest": "sha256:77b7dc49c176c90d9276490ea32b9406c92eadfd12438a2aea924c44c8b3806b"
      },
      {
        "name": "skillrun-installer.ps1",
        "kind": "installer",
        "platform": "Windows",
        "url": "https://github.com/iiwish/skillrun/releases/download/v0.6.5/skillrun-installer.ps1",
        "digest": "sha256:8bd7e7a0de82a88bc755328375066d63e0d2bb2d523c1ff88b5c57caf08924d8"
      },
      {
        "name": "skillrun-aarch64-apple-darwin.tar.xz",
        "kind": "archive",
        "platform": "macOS arm64",
        "url": "https://github.com/iiwish/skillrun/releases/download/v0.6.5/skillrun-aarch64-apple-darwin.tar.xz",
        "digest": "sha256:4cdc87db735432ec696484e70b9fdfc60e0c282d67ae1c7a33928917b01ab809"
      },
      {
        "name": "skillrun-x86_64-apple-darwin.tar.xz",
        "kind": "archive",
        "platform": "macOS x64",
        "url": "https://github.com/iiwish/skillrun/releases/download/v0.6.5/skillrun-x86_64-apple-darwin.tar.xz",
        "digest": "sha256:a86ca7cdb9ca1d961c2f0d7850036f3cbea56e38e6079ebc63788fbab94dd530"
      },
      {
        "name": "skillrun-aarch64-unknown-linux-gnu.tar.xz",
        "kind": "archive",
        "platform": "Linux arm64",
        "url": "https://github.com/iiwish/skillrun/releases/download/v0.6.5/skillrun-aarch64-unknown-linux-gnu.tar.xz",
        "digest": "sha256:7e628bb968284654fa05c0a396b8d93d566ca6e320712730c769665a07644c46"
      },
      {
        "name": "skillrun-x86_64-unknown-linux-gnu.tar.xz",
        "kind": "archive",
        "platform": "Linux x64",
        "url": "https://github.com/iiwish/skillrun/releases/download/v0.6.5/skillrun-x86_64-unknown-linux-gnu.tar.xz",
        "digest": "sha256:970d146f7ee3920be8ffc0625eb2118f953dbf423ad40eb9e38f06aa7a700530"
      },
      {
        "name": "skillrun-x86_64-pc-windows-msvc.zip",
        "kind": "archive",
        "platform": "Windows x64",
        "url": "https://github.com/iiwish/skillrun/releases/download/v0.6.5/skillrun-x86_64-pc-windows-msvc.zip",
        "digest": "sha256:a8270bb59e7465f286aef82c82188303a5c3a22a66a0981b1fc88a8fffce73ab"
      }
    ],
    "current_capabilities": [
      "Native installers for macOS, Linux, and Windows",
      "Local .skr import, replace, registry, and switchboard",
      "Team Catalog inspect, install plan, and guarded local install apply",
      "Router status, dry-run, and MCP mount plan/apply",
      "Run evidence filters and local metadata index",
      "Artifact containment",
      "Dependency awareness",
      "Structured error envelopes",
      "Source and Manifest validation"
    ]
  },
  "quickstart": {
    "author_commands": [
      "skillrun init refund --python --output tmp/quickstart",
      "skillrun manifest --cwd tmp/quickstart/refund",
      "skillrun check --cwd tmp/quickstart/refund",
      "skillrun validate --cwd tmp/quickstart/refund",
      "skillrun pack --cwd tmp/quickstart/refund"
    ],
    "consumer_commands": [
      "skillrun import <package.skr> --id refund --json",
      "skillrun consumer inventory --json",
      "skillrun switchboard enable refund",
      "skillrun consumer exposure --json"
    ],
    "router_commands": [
      "skillrun router status --json",
      "skillrun mount plan --client claude-desktop --json",
      "skillrun mount apply --client claude-desktop --json"
    ]
  },
  "trust_boundaries": {
    "current": [
      "Consumer Mode does not dynamically import untrusted source code for metadata extraction.",
      "SkillRun fails closed if Manifest is missing, stale, or source hashes mismatch.",
      "Core only injects business env variables declared in the Manifest.",
      "stdout/stderr are treated only as logs; structured results must come from the output/error envelope.",
      "Artifact paths are bound to the run-local artifact directory.",
      ".skr is a source + Manifest archive, not a secure install format.",
      "switchboard enabled=true is exposure intent, not proof of trust or sandboxing.",
      "Runs list and local indexes stay summary-only by default; input, envelope bodies, stdout, and stderr are not copied into list output.",
      "Structured errors provide recoverable behavior suggestions for Agents."
    ],
    "not_promised": [
      "Full OS sandboxing or filesystem jails.",
      "Network egress isolation or malicious code detection.",
      "Automatic installation of Python, Node, npm, or pip packages.",
      "Public marketplace trust, reproducible runtime images, or signed package trust."
    ]
  },
  "team_distribution": {
    "status": "released",
    "summary": "Team catalog inspect, install plan, and guarded install apply are available in v0.6.5 for Desktop Team Library. Team distribution is not a public marketplace.",
    "boundaries": [
      "Core verifies checksums and imports into the local registry.",
      "Enable and mount remain explicit user choices.",
      "No downloader, dependency installation, action execution, MCP server start, trust decision, or sandbox promise is implied by catalog metadata."
    ]
  }
}
